{
  "schemaVersion": "0.1.0",
  "ticketKey": "aaaaaaaaaaaaaaaaaaaaaaaaaaaaaaaaaaaaaaaaaaaaaaaaaaaaaaaaaaaaaaaa",
  "ticket": {
    "backend": "github",
    "project": "BjRo/darrow",
    "nativeId": "4",
    "url": "https://github.com/BjRo/darrow/issues/4"
  },
  "publications": [
    {
      "publicationId": "bbbbbbbbbbbbbbbbbbbbbbbbbbbbbbbbbbbbbbbbbbbbbbbbbbbbbbbbbbbbbbbb",
      "artifactId": "artifact-1",
      "runId": "run-1",
      "stepId": "implement",
      "attemptId": "attempt-1",
      "type": "darrow.tdd-evidence",
      "contentHash": "sha256:cccccccccccccccccccccccccccccccccccccccccccccccccccccccccccccccc",
      "size": 120,
      "sourceLocation": ".darrow/runs/run-1/artifacts/implement/attempt-1/tdd-evidence",
      "location": ".darrow/tickets/aaaaaaaaaaaaaaaaaaaaaaaaaaaaaaaaaaaaaaaaaaaaaaaaaaaaaaaaaaaaaaaa/artifacts/implement/attempt-1/bbbbbbbbbbbbbbbb-tdd-evidence",
      "publishedAt": "2026-07-17T10:00:00.000Z"
    }
  ]
}
